{
  "$schema": "https://json-schema.org/draft/2020-12/schema",
  "type": "object",
  "required": ["source", "game_build", "extracted_at", "entries"],
  "additionalProperties": false,
  "properties": {
    "source": {"const": "local-starcraft-ii-client"},
    "game_build": {"type": "string", "minLength": 1},
    "extracted_at": {"type": "string", "format": "date-time"},
    "entries": {
      "type": "array",
      "items": {
        "type": "object",
        "required": ["id", "en", "zh-CN", "kind", "source_file"],
        "additionalProperties": false,
        "properties": {
          "id": {"type": "string", "minLength": 1},
          "en": {"type": "string", "minLength": 1},
          "zh-CN": {"type": "string", "minLength": 1},
          "kind": {"type": "string", "minLength": 1},
          "source_file": {"type": "string", "minLength": 1}
        }
      }
    }
  }
}
